Year,Month,Day,Time,End Year,End Month,End Day,End Time,Display Date,Headline,Text,Media,Media Credit,Media Caption,Media Thumbnail,Type,Group,Background
,,,,,,,,,História da Computação,Essa linha do tempo mostrará os principais acontecimentos da história da computação em ordem cronológica.,,,,,title,,https://gpjinformatica.files.wordpress.com/2018/05/img_817x4602016_02_12_12_06_55_276211.jpeg
-1100,,,,,,,,,Ábaco,"O <a href=""https://pt.wikipedia.org/wiki/%C3%81baco"" target=""_blank""><b>ábaco</b></a>, é um antigo instrumento de cálculo, popularmente em sistema decimal, que remonta pelo menos a 1100 a.C. e ainda está em uso hoje, principalmente na Ásia. Juntamente com a invenção do zero na Índia, pode ter inspirado a invenção do sistema de numeração hindu-árabe.",https://upload.wikimedia.org/wikipedia/commons/1/13/Kulram.jpg,,,,,,#a86e20
1550,2,1,,1617,4,4,,,John Napier,"<p><a href=""https://pt.wikipedia.org/wiki/John_Napier"" target=""_blank""><b>John Napier of Merchiston</b></a> era um proprietário escocês conhecido como um matemático, físico, e astrônomo, é mais conhecido como o descobridor de logaritmos. </p>Ele também inventou os chamados ""ossos de Napier"" e tornou comum o uso do ponto decimal na aritmética e na matemática.",https://upload.wikimedia.org/wikipedia/commons/e/e3/John_Napier.jpg,,,,,,#808080
1623,6,19,,1662,8,19,,,Blaise Pascal,"<p><a href=""https://pt.wikipedia.org/wiki/Blaise_Pascal"" target=""_blank""><b>Blaise Pascal</b></a> foi um matemático, escritor, físico, inventor, filósofo e teólogo francês. Inventou a primeira calculadora mecânica, para ajudar seu pai contador de impostos. </p>A máquina ficou conhecida como <a href=""https://pt.wikipedia.org/wiki/Pascalina"" target=""_blank""><b>Máquina Aritmética de Pascal (Pascaline)</b></a> e foi construída entre 1642-1644.",https://upload.wikimedia.org/wikipedia/commons/thumb/9/98/Blaise_Pascal_Versailles.JPG/800px-Blaise_Pascal_Versailles.JPG,,,,,,#808080
1642,,,,,,,,,Pascalina,"A pascalina, também conhecida como máquina de Pascal, calculadora de Pascal e máquina aritmética, é uma calculadora mecânica inventada por Blaise Pascal em 1642. Ele projetou a máquina para adicionar e subtrair dois números diretamente e realizar multiplicações e divisões através de repetidas adições ou subtrações.",https://upload.wikimedia.org/wikipedia/commons/8/80/Arts_et_Metiers_Pascaline_dsc03869.jpg,,,,,,#fca311
1673,,,,,,,,,Step Reckoner,"Construída pela primeira vez em 1673, o matemático e filósofo alemão Gottfried Wilhelm von Leibniz projetou uma máquina de calcular chamada <a href=""https://en.wikipedia.org/wiki/Stepped_reckoner"" target=""_blank""><b>Step Reckoner</b></a>. O Step Reckoner expandiu as ideias de Pascal e fez a multiplicação por adição e deslocamento repetidos. Leibniz foi visionário ao ver a adequação do sistema binário em máquinas de calcular, mas sua máquina não o utilizou.",https://upload.wikimedia.org/wikipedia/commons/thumb/9/92/Leibnitzrechenmaschine.jpg/1280px-Leibnitzrechenmaschine.jpg,,,,,,#fca311
1760,,,,1840,,,,,Revolução Industrial,"<p>A <a href=""https://pt.wikipedia.org/wiki/Revolu%C3%A7%C3%A3o_Industrial"" target=""_blank""><b>Revolução Industrial</b></a> foi a transição para novos processos de fabricação na Grã-Bretanha, Europa continental e Estados Unidos, no período de cerca de 1760 a algum momento entre 1820 e 1840. </p>Essa transição incluiu a passagem de métodos de produção manual para máquinas, novos processos de fabricação de produtos químicos e produção de ferro, o uso crescente de energia a vapor e hidráulica, o desenvolvimento de máquinas-ferramentas e a ascensão do sistema fabril mecanizado.",,,,,,,https://i0.wp.com/paulogala.com.br/wp-content/uploads/2023/06/img_3837.jpg?fit=675%2C454&ssl=1
1804,,,,,,,,,Tear de Jacquard,"<p>O tear de Jacquard foi inventado em 1804-05 por um tecelão francês, <a href=""https://pt.wikipedia.org/wiki/Joseph-Marie_Jacquard"" target=""_blank""><b>Joseph-Marie Jacquard</b></a>. O tear de Jacquard foi uma maravilha da Revolução Industrial. Um tear de tecelagem têxtil foi o primeiro dispositivo prático de processamento de informações. </p>O tear funcionava puxando fios de várias cores em padrões por meio de uma série de hastes. Ao inserir um cartão perfurado com furos, um operador pode controlar o movimento das hastes e, assim, alterar o padrão da trama.",https://www.youtube.com/watch?v=okr_hJOkxcM,,,,,,#000000
1791,12,26,,1871,8,18,,,Charles Babbage,"<a href=""https://pt.wikipedia.org/wiki/Revolu%C3%A7%C3%A3o_Industrial"" target=""_blank""><b>Charles Babbage</b></a> foi um matemático e inventor inglês. Ele inventou o cowcatcher, reformou o sistema postal britânico e foi um pioneiro nas áreas de pesquisa operacional e ciência atuarial.",https://upload.wikimedia.org/wikipedia/commons/thumb/6/6b/Charles_Babbage_-_1860.jpg/800px-Charles_Babbage_-_1860.jpg,,,,,,#808080
1822,,,,,,,,,Máquina Diferencial,"<p>As tabelas matemáticas usadas frequentemente continham erros, com consequências críticas para marinheiros. Babbage propôs automatizar a produção dessas tabelas para garantir precisão. Após obter apoio da sociedade, buscou financiamento do governo britânico, apresentando a <a href=""https://pt.wikipedia.org/wiki/M%C3%A1quina_diferencial"" target=""_blank""><b>Máquina Diferencial</b></a> em 1822. A Máquina de Diferenças tinha armazenamento - isto é, um local onde os dados podiam ser mantidos temporariamente para processamento posterior.</p> No entanto, a Máquina de Diferenças realizou apenas uma operação, resolver equações polinômicas através de diferenças entre números, e assim, efetuar os cálculos necessários para construir tabelas de logaritmos.",https://i0.wp.com/dunapress.com/wp-content/uploads/2019/03/computador2.jpg?fit=350%2C392&ssl=1,,,,,,#fca311
1837,,,,,,,,,Máquina Analítica,"<p>A <a href=""https://pt.wikipedia.org/wiki/M%C3%A1quina_anal%C3%ADtica"" target=""_blank""><b>Máquina Analítica</b></a> era composta por <b>quatro componentes essenciais: moinho</b> (unidade de cálculo, equivalente à CPU), <b>armazém</b> (local de armazenamento de dados, análogo à memória nos computadores modernos), <b>leitor e impressora</b> (dispositivos de entrada e saída). Esses elementos são fundamentais em todos os computadores atuais.</p> Os dados (números) eram inseridos em cartões perfurados, utilizando a tecnologia do Tear de Jacquard para leitura. As instruções também eram registradas em cartões, inspiradas na tecnologia de Jacquard. A inclusão de cartões de instrução tornava a máquina programável e mais flexível do que qualquer máquina existente na época. <b>Embora não concluída, a Máquina Analítica foi pioneira ao merecer o título de primeiro computador.</b>",https://upload.wikimedia.org/wikipedia/commons/thumb/a/ac/AnalyticalMachine_Babbage_London.jpg/1024px-AnalyticalMachine_Babbage_London.jpg,,,,,,#4a4e69
1815,12,10,,1852,11,27,,,Ada Lovelace,"<a href=""https://pt.wikipedia.org/wiki/Ada_Lovelace"" target=""_blank""><b>Augusta Ada Byron King</b></a>, Condessa de Lovelace, atualmente conhecida como Ada Lovelace, foi uma matemática e escritora inglesa. Ela se tornou a única especialista do mundo no processo de sequenciamento de instruções nos cartões perfurados que a Máquina Analítica usava, ou seja, ela se tornou a primeira programadora de computador de mundo.",https://upload.wikimedia.org/wikipedia/commons/0/0f/Ada_lovelace.jpg,,,,,,#808080
1860,2,29,,1929,11,17,,,Herman Hollerith,"<a href=""https://pt.wikipedia.org/wiki/Herman_Hollerith"" target=""_blank""><b>Herman Hollerith</b></a> foi um empresário norte-americano e o principal impulsionador do leitor de cartões perfurados, principal forma de entrada de informação nos computadores da época. Foi também um dos fundadores da <a href=""https://pt.wikipedia.org/wiki/IBM"" target=""_blank""><b>IBM (International Business Machine Corporation)</b></a>, precursor do processamento de dados, e construiu o primeiro computador mecânico.",https://upload.wikimedia.org/wikipedia/commons/thumb/4/42/Hollerith.jpg/800px-Hollerith.jpg,,,,,,#808080
1870,,,,,,,,,Censo Populacional dos EUA,"A Constituição dos EUA requer um censo a cada 10 anos. A primeira tentativa de mecanização foi em 1870, usando fita de papel. Herman Hollerith, formado em 1879, percebeu a necessidade de automatizar a tabulação enquanto trabalhava no censo de 1880, após ser contratado por um ex-professor para trabalhar na Census Office. Nos 10 anos seguintes, Hollerith refinou suas ideias, obtendo sua primeira patente, em 1884, para uma máquina para perfurar e contar cartões.",https://www.americanproject.com.br/wp-content/uploads/2020/08/numero-de-residentes-permanentes-legais-eua-1820-2018.png,,,,,,#000000
1890,,,,,,,,,Tabulador de Censo de Hollerith,"Hollerith então organizou os registros de saúde de Baltimore, Maryland, da cidade de Nova York e do estado de Nova Jersey - tudo em preparação para ganhar o contrato para tabular o Censo dos EUA de 1890. O sucesso do censo dos EUA abriu os governos europeus para as máquinas de Hollerith. Um contrato com o governo russo, assinado em 15 de dezembro de 1896, pode tê-lo induzido a fundar a Tabating Machine Company em 5 de dezembro de 1896.",https://upload.wikimedia.org/wikipedia/commons/thumb/4/4e/HollerithMachine.CHM.jpg/1280px-HollerithMachine.CHM.jpg,,,,,,#fca311
1930,,,,,,,,,Invenção do Computador Moderno,"Em 1930, um engenheiro chamado <a href=""https://pt.wikipedia.org/wiki/Vannevar_Bush"" target=""_blank""><b>Vannevar Bush</b></a>, do MIT, desenvolveu o primeiro computador analógico moderno. O <b>Analisador Diferencial</b> era uma calculadora analógica que podia ser usada para resolver certas classes de equações diferenciais. O Analisador Diferencial provou ser muito útil, e vários deles foram construídos e usados em várias universidades. O dispositivo limitava-se a resolver esse tipo de problema e, como é o caso de todos os dispositivos analógicos, produzia soluções aproximadas, embora práticas",https://pt.wikipedia.org/wiki/Computador_anal%C3%B3gico,,,,,,
1936,,,,,,,,,Alan Turing,"<a href=""https://pt.wikipedia.org/wiki/Alan_Turing"" target=""_blank""><b>Alan Mathison Turing</b></a> (23 de junho de 1912 - 7 de junho de 1954) foi um matemático, cientista da computação, lógico, criptoanalista, filósofo e biólogo teórico britânico. Quando era estudante de Matemática na Universidade de Cambridge, inspirou-se no matemático alemão David Hilbert, que procurava demonstrar que <b>qualquer problema matemático pode potencialmente ser resolvido por um algoritmo – isto é, por um processo puramente mecânico.</b> Turing interpretou isso como uma máquina de computação e decidiu projetar uma capaz de resolver todos os problemas matemáticos.",https://s1.static.brasilescola.uol.com.br/img/2019/09/alan-turing-be.jpg,,,,,,#808080
1936,,,,,,,,,A Máquina de Turing,"<p>Para projetar sua máquina, Turing precisava de uma definição inequívoca da essência de um computador. <b>Ele elaborou os conceitos básicos de uma máquina de computação universal, capaz de realizar qualquer tarefa que um dispositivo de computação de propósito especial pudesse fazer, não se limitando apenas à aritmética, mas também podendo lidar com valores lógicos, letras e até estados mentais abstratos.</b> </p>Seu trabalho teórico implicava a possibilidade de construir tal máquina. Isso representou um desafio, já que caracterizou tão bem a essência abstrata de qualquer dispositivo de computação. A inspiração de Turing levou à concepção de uma máquina de computação universal, algo que a maioria do mundo ainda não havia sequer imaginado.",https://pt.wikipedia.org/wiki/M%C3%A1quina_de_Turing,,,,,,
1937,,,,,,,,,Calculadora Digital,"Enquanto Bush se dedicava à computação analógica no MIT, <a href=""https://pt.wikipedia.org/wiki/Howard_Aiken"" target=""_blank""><b>Howard Aiken</b></a>, professor de Harvard, focava em dispositivos digitais para cálculos, inspirado na Máquina Analítica de Babbage. <b>A partir de 1937, Aiken desenvolveu uma série de 4 máquinas de calcular com crescente sofisticação, explorando avanços tecnológicos desde a mecânica Mark I até a eletrônica Mark IV</b>, meticulosamente considerando os progressos desde a era de Babbage. Circuitos de relés e tubos de vácuo foram usados nas primeiras máquinas experimentais, enquanto máquinas da época usavam quadros de tomadas para rotear dados manualmente. A máquina de Aiken foi mais fácil de programar do que o ENIAC, pois não necessitava de reconexão manual para cada programa.",https://upload.wikimedia.org/wikipedia/commons/c/c9/Aiken.jpeg,,"Howard Aiken, professor de Havard e desenvolvedor da Mark I até a IV",,,,#808080
1939,,,,1944,,,,,Havard Mark I,"<p>De 1939 a 1944, Aiken, em colaboração com a IBM, desenvolveu seu primeiro computador totalmente funcional, conhecido como <a href=""https://pt.wikipedia.org/wiki/Harvard_Mark_I"" target=""_blank""><b>Harvard Mark I</b></a>. A máquina, como a de Babbage, era enorme: mais de 15 metros de comprimento, pesando cinco toneladas e consistindo de cerca de 750.000 peças separadas, era principalmente mecânico. </p>Para entrada e saída, usava três leitores de fita de papel, dois leitores de cartões, um furador de cartões e duas máquinas de escrever. Demorava entre três e seis segundos para adicionar dois números. <b>Aiken desenvolveu mais 3 dessas máquinas (Mark II–IV) nos anos seguintes e é creditado pelo desenvolvimento da primeira calculadora de grande escala totalmente automática.</b>",https://upload.wikimedia.org/wikipedia/commons/thumb/3/35/Harvard_Mark_I_Computer_-_Right_Segment.JPG/1280px-Harvard_Mark_I_Computer_-_Right_Segment.JPG,,,,,,#4a4e69
1940,,,,,,,,,Computador Clifford Berry e AtanasoffBerry,"<p>Acredita-se que os primeiros computadores digitais eletrônicos foram o <a href=""https://pt.wikipedia.org/wiki/Colossus_(computador)"" target=""_blank""><b>Colossus</b></a>, construído na Inglaterra em 1943, e o ENIAC, construído nos Estados Unidos em 1945. No entanto, o primeiro computador eletrônico para fins especiais pode ter sido inventado por John Vincent Atanasoff, físico e matemático do Iowa State College (hoje Iowa State University), durante 1937–42.</p><p><b>PROJETO:</b> Capacitores para armazenar dados em formato binário e circuitos lógicos eletrônicos para realizar adição e subtração.</p>Eles começaram a projetar e construir um computador maior e mais geral, conhecido como Computador Atanasoff-Berry, ou ABC. <b>Vários componentes do ABC foram desenvolvidos de 1939 a 1942, mas o desenvolvimento foi interrompido com o início da Segunda Guerra Mundial.</b> O ABC contava com cerca de 300 tubos de vácuo para controle e cálculos aritméticos, operações lógicas, capacitores de memória e cartões perfurados como unidades de entrada/saída.",https://upload.wikimedia.org/wikipedia/commons/thumb/0/01/Atanasoff-Berry_Computer_at_Durhum_Center.jpg/800px-Atanasoff-Berry_Computer_at_Durhum_Center.jpg,,,,,,#4a4e69
1940,,,,,,,,,Primeira Rede de Computadores,"<b>Entre 1940 e 1946, <a href=""https://pt.wikipedia.org/wiki/George_Stibitz"" target=""_blank"">George Stibitz</a> e sua equipe dos Laboratórios Bell construíram uma série de máquinas com tecnologias telefônicas – ou seja, empregando relés eletromecânicos.</b> Estas foram as primeiras máquinas a atender mais de um usuário e as primeiras a trabalhar remotamente por linhas telefônicas. No entanto, como eram baseados em relés mecânicos lentos, em vez de interruptores eletrônicos, tornaram-se obsoletos assim que foram construídos",https://images.prismic.io/voitto-blog/cf699ddd-8f3a-4d72-a53a-fb80973050f4_redes-de-computadores.jpg,,,,,,#4a4e69
1941,,,,,,,,,Konrad Zuse - Z3,"<p>Na Alemanha, o engenheiro <a href=""https://pt.wikipedia.org/wiki/Konrad_Zuse"" target=""_blank""><b>Konrad Zuse</b></a> estava pensando em máquinas de calcular. Em 1937, foi informado por um fabricante de calculadoras que todos os problemas de computação já haviam sido resolvidos, mas Zuse persistiu. Trabalhando em binário desde o início, ele teve a vantagem de uma conexão mais clara com a lógica, elaborando os detalhes de como as operações lógicas poderiam ser mapeadas no projeto dos circuitos do computador. </p>Zuse também dedicou tempo ao desenvolvimento de software, especialmente a linguagem em que seu computador deveria ser programado. Seu <a href=""https://pt.wikipedia.org/wiki/Z3"" target=""_blank""><b>Z3</b></a>, concluído em dezembro de 1941, foi o primeiro processador controlado por programa. Apesar de seu trabalho ter sido realizado em relativo isolamento, Zuse soube pouco sobre os avanços em computação nos EUA e na Inglaterra, e o início da guerra intensificou esse isolamento.",https://upload.wikimedia.org/wikipedia/commons/thumb/4/4c/Z3_Deutsches_Museum.JPG/1280px-Z3_Deutsches_Museum.JPG,,,,,,#fca311
1942,,,,,,,,,II Guerra Mundial: Colossus,"<p>• As exigências da guerra deram ímpeto e financiamento à pesquisa por computador.</p>• Na Grã-Bretanha, o ímpeto foi a quebra de códigos.</p>• <b>O projeto Ultra foi financiado com muito sigilo para desenvolver a tecnologia necessária para decifrar cifras e códigos produzidos pelos dispositivos eletromecânicos alemães conhecidos como Enigma e Geheimschreiber (“Escritor Secreto”).</b></p>• <b>A primeira de uma série de importantes máquinas de quebra de código, a Colossus, foi construída em dezembro de 1943 no centro de pesquisa do governo ao norte de Londres.</b></p>• Ela empregou aproximadamente 1.800 tubos de vácuo para cálculos.</p>• Versões sucessivamente maiores e mais elaboradas foram construídas nos dois anos seguintes.",https://www.youtube.com/watch?v=E0YX8BC4RLo,,,,,,#000000
1943,,,,,,,,,Colossus,"O projeto <a href=""https://pt.wikipedia.org/wiki/Ultra#:~:text=Ultra%20(tamb%C3%A9m%20escrito%20em%20letras,and%20Cypher%20School%20(GC%26CS)%20em"" target=""_blank""><b>Ultra</b></a>, apoiado por Alan Turing, possivelmente impulsionou a ideia de um dispositivo de uso geral, indo além do que o governo originalmente planejou. <b>O Colossus, considerado o primeiro computador digital eletrônico</b>, foi crucial para o desenvolvimento do computador moderno, mesmo sendo projetado para cálculos criptográficos específicos. <b>O sucesso do Colossus em decifrar mensagens alemãs foi significativo para a guerra.</b> Após a guerra, os computadores Colossus foram desmontados e mantidos em segredo até a década de 1990. Em 1996, uma versão básica do Colossus foi reconstruída em Bletchley Park.",https://upload.wikimedia.org/wikipedia/commons/thumb/4/4b/Colossus.jpg/1280px-Colossus.jpg,,,,,,#000000
1943,,,,,,,,,Z4,"<p>Na Alemanha, Konrad Zuse começou a construir o <a href=""https://pt.wikipedia.org/wiki/Z4"" target=""_blank""><b>Z4</b></a> em 1943, financiado pelo Ministério da Aeronáutica. Ele utilizou relés eletromecânicos devido à escassez de tubos de vácuo durante a guerra. <b>Embora Zuse não tenha continuado a desenvolver hardware, ele fez avanços significativos no design de software</b>, incluindo a introdução da representação de ponto flutuante para números e a inclusão de um conjunto rico de instruções, incluindo um ""no-op"". </p>O programa do Z4 era perfurado em filme e separado da memória mecânica, sem armazenamento de programa. Apesar de ser relativamente confiável, não tinha capacidade de tomar decisões, e suas operações de adição levavam de 0,5 a 1,25 segundos, enquanto a multiplicação levava cerca de 3,5 segundos.",https://upload.wikimedia.org/wikipedia/commons/thumb/b/bc/Zuse-Z4-Totale_deutsches-museum.jpg/1280px-Zuse-Z4-Totale_deutsches-museum.jpg,,,,,,#fca311
1946,,,,,,,,,ENIAC,"<p><a href=""https://pt.wikipedia.org/wiki/ENIAC"" target=""_blank""><b>Electronic Numerical Integrator and Computer</b></a> (ENIAC - em português: computador integrador numérico eletrônico) <b>foi o primeiro computador digital eletrônico de grande escala.</b> Muitos comentam que o primeiro foi o Mark I, mas este era apenas eletromecânico. O ENIAC entrou em funcionamento em fevereiro de 1946 pelas mãos dos cientistas norte-americanos John Eckert e John Mauchly, da Electronic Control Company.</p> <b>O ENIAC começou a ser desenvolvido em 1943 durante a II Guerra Mundial para computar trajetórias táticas que exigiam conhecimento substancial em matemática com mais agilidade, mas só se tornou operacional após o final da guerra.</b>",https://upload.wikimedia.org/wikipedia/commons/3/3b/Two_women_operating_ENIAC.gif,,,,,,#14213d
1946,,,,,,,,,Características ENIAC,"<p>• <b>Projetado para calcular valores para tabelas de alcance de artilharia.</b></p> • Usava plugboards para comunicar instruções à máquina, permitindo operar em velocidade eletrônica.</p> • Instruções lidas de dispositivos mecânicos lentos não acompanhavam totalmente sua velocidade eletrônica.</p> • Levava dias para religar a máquina a cada novo problema, o que dificultava consideravelmente sua usabilidade como programável.</p> • O ENIAC era enorme, ocupando um porão de 15 por 9 metros e consistindo de 40 painéis dispostos em forma de U ao longo de três paredes.</p> • Cada unidade tinha cerca de 0,6 por 0,6 por 2,4 metros e era composta por aproximadamente 18.000 válvulas, 70.000 resistores, 10.000 capacitores, 6.000 interruptores e 1.500 relés.</p> • O ENIAC funcionava continuamente, gerando 150 quilowatts de calor e podendo executar até 5.000 adições por segundo, muito mais rápido que seus antecessores eletromecânicos.</p> • Concluído em fevereiro de 1946, o ENIAC custou ao governo US$ 400 mil, sendo sua primeira tarefa fazer cálculos para a construção de uma bomba de hidrogênio.",,,,,,,#14213d
1946,,,,,,,,,EDVAC,"<p>O <a href=""https://pt.wikipedia.org/wiki/EDVAC#:~:text=EDVAC%20(Electronic%20Discrete%20Variable%20Automatic,um%20dos%20primeiros%20computadores%20eletr%C3%B4nicos.&text=Diferentemente%20de%20seu%20predecessor%20ENIAC,possu%C3%ADa%20arquitetura%20de%20von%20Neumann."" target=""_blank""><b>EDVAC (Electronic Discrete Variable Automatic Computer)</b></a> foi um dos primeiros computadores eletrônicos. Em contraste com seu predecessor, o ENIAC, o EDVAC utilizava o sistema binário e possuía a arquitetura de von Neumann.</p> Antes da invenção da memória de núcleo magnético e do transistor, que eliminaria completamente a necessidade de válvulas a vácuo, a linha de atraso de mercúrio foi crucial para aumentar o armazenamento e a confiabilidade do computador. Enquanto o ENIAC exigia uma válvula por bit, o EDVAC poderia usar uma linha de atraso e 10 válvulas a vácuo para armazenar 1.000 bits.",https://danieltiezzi.pro.br/basic_program/aula1/_img/vonNeu.png,,,,,,#14213d
1946,,,,,,,,,Projeto EDVAC,"<p><b>• Unidades:</b> controle, aritmética, memória, E/S </p><b>• Memória:</b> linhas de atraso acústico de mercúrio (8.196 palavras de 32 bits) – equivalente a 32 kBytes </p>• Representação binária, ponto fixo, complemento de 2 </p>• Instruções e dados armazenados na memória </p><b>• Instruções:</b> carga, armazenamento, operações aritméticas, desvios condicionais e incondicionais </p>• Implementação de instruções com um endereço vs. implementação com quatro endereços (discussão RISC vs. CISC) </p>• Cerca de 3.000 válvulas eletrônicas (ENIAC usou mais de 17.000, para uma memória de 200 dígitos decimais) </p>• Von Neumann: Primeiro rascunho do EDVAC (1945) de grande impacto (circulação informal) – deu origem ao termo arquitetura de von Neumann </p>• <b>Primeiras técnicas de programação.</b>",https://upload.wikimedia.org/wikipedia/commons/thumb/1/17/Edvac.jpg/592px-Edvac.jpg,,,,,,#14213d
1947,,,,1955,,,,,Primeira Geração (1943-1955) – <b>A válvula é o componente básico</b>,<p><b>• Grande:</b> Esquentava muito e gastava muita energia elétrica </p>• Ocupava muito espaço físico </p><b>• Dispositivos de Entrada/Saída:</b> primitivos (cartões perfurados) </p><b>• Aplicação:</b> científica e militar </p><b>• Linguagem de programação:</b> linguagem de máquina,https://upload.wikimedia.org/wikipedia/commons/8/89/VacuumTube1.jpg?20050713170725,,,,,,
1956,,,,1964,,,,,Segunda Geração (1955- 1964) – <b>Transistores</b>,"<p><b>• Vantagens:</b> menores, consumiam menos corrente elétrica, maior durabilidade </p><b>• Computadores:</b> menores, mais rápidos, mais confiáveis e mais baratos </p><b>• Fabricação em série:</b> tornou-se comum </p><b>• Unidades de fitas magnéticas:</b> para troca de informações entre computadores semelhantes </p><b>• Aplicações:</b> científica, militar, administrativa e gerencial </p><b>• Surgimento:</b> das primeiras linguagens de programação em linguagem natural",https://upload.wikimedia.org/wikipedia/commons/thumb/f/f8/Transistor-photo.JPG/640px-Transistor-photo.JPG,,,,,,
